{
  "board": "Alveo U250",
  "fpga": "XCU250-FIGD2104-2L-E",
  "toolchain": "Vivado 2024.1",
  "bitstream_hash": "0000000000000000000000000000000000000000000000000000000000000000",
  "clock_mhz": 200,
  "pcie_generation": 4,
  "pcie_width": 16,
  "host_cpu": "example only -- not a real host",
  "operation": "q8_encode",
  "precision": "q8_0",
  "batch_size": 64,
  "queue_depth": 16,
  "bytes": 68719476736,
  "throughput_bytes_per_sec": 1000000000,
  "latency_ns": { "p50": 500, "p95": 900, "p99": 1500 },
  "cpu_utilization_pct": 12.5,
  "board_power_watts": 45.0,
  "temperature_celsius": 55.0,
  "parity_failures": 0,
  "timestamp_utc": "2000-01-01T00:00:00Z",
  "result_label": "DOCUMENTED_EXAMPLE",
  "notes": "Fictional example fixture for schema illustration only. Every numeric value here is a plausible placeholder, not a measurement. Do not cite this file anywhere as evidence of a real hardware result."
}
